{
  "boundary_summaries": [
    {
      "blockers": [],
      "can_close": true,
      "evidence_paths": [
        "baseline/AndroidClient/transport/src/test/kotlin/dev/telemachus/display/transport/StreamTransportOwnerTest.kt",
        "docs/changes/2026-08-04-phase-0-baseline/TECH.md"
      ],
      "fail_closed_checklist": [],
      "focused_tests": [
        "make baseline-android-transport-boundary"
      ],
      "id": "transport_dependency_direction",
      "issues": [],
      "missing_evidence_paths": [],
      "owner_surface": "baseline/AndroidClient/transport",
      "required_for_phase0_stable": true,
      "status": "closed",
      "title": "Android TCP transport dependency direction"
    },
    {
      "blockers": [],
      "can_close": true,
      "evidence_paths": [
        "baseline/AndroidClient/transport/src/test/kotlin/dev/telemachus/display/transport/StreamTransportOwnerTest.kt",
        "docs/changes/2026-08-04-phase-0-baseline/TECH.md"
      ],
      "fail_closed_checklist": [],
      "focused_tests": [
        "make baseline-android-transport-boundary"
      ],
      "id": "transport_resource_lifecycle",
      "issues": [],
      "missing_evidence_paths": [],
      "owner_surface": "baseline/AndroidClient/transport",
      "required_for_phase0_stable": true,
      "status": "closed",
      "title": "Android TCP transport resource lifecycle"
    },
    {
      "blockers": [],
      "can_close": true,
      "evidence_paths": [
        "baseline/AndroidClient/app/src/main/java/dev/telemachus/display/StreamClientLocalSessionState.kt",
        "baseline/AndroidClient/app/src/test/java/dev/telemachus/display/StreamClientLocalSessionStateTest.kt",
        "baseline/AndroidClient/app/src/test/java/dev/telemachus/display/StreamClientOwnershipBoundaryContractTest.kt"
      ],
      "fail_closed_checklist": [],
      "focused_tests": [
        "./gradlew --no-daemon testDebugUnitTest --tests dev.telemachus.display.StreamClientLocalSessionStateTest --tests dev.telemachus.display.StreamClientOwnershipBoundaryContractTest"
      ],
      "id": "stream_client_local_session_state",
      "issues": [],
      "missing_evidence_paths": [],
      "owner_surface": "baseline/AndroidClient/app/src/main/java/dev/telemachus/display/StreamClientLocalSessionState.kt",
      "required_for_phase0_stable": true,
      "status": "closed",
      "title": "StreamClient local product-session lifecycle owner"
    },
    {
      "blockers": [],
      "can_close": true,
      "evidence_paths": [
        "baseline/AndroidClient/app/src/main/java/dev/telemachus/display/StreamProtocolActionDispatcher.kt",
        "baseline/AndroidClient/app/src/test/java/dev/telemachus/display/StreamProtocolActionDispatcherTest.kt",
        "baseline/AndroidClient/app/src/test/java/dev/telemachus/display/StreamClientOwnershipBoundaryContractTest.kt"
      ],
      "fail_closed_checklist": [],
      "focused_tests": [
        "make baseline-android-protocol-side-effect-owner"
      ],
      "id": "stream_client_protocol_action_dispatch",
      "issues": [],
      "missing_evidence_paths": [],
      "owner_surface": "baseline/AndroidClient/app/src/main/java/dev/telemachus/display/StreamProtocolActionDispatcher.kt",
      "required_for_phase0_stable": true,
      "status": "closed",
      "title": "StreamClient Protocol v1 action dispatch owner"
    },
    {
      "blockers": [],
      "can_close": true,
      "evidence_paths": [
        "baseline/AndroidClient/app/src/main/java/dev/telemachus/display/StreamInputDispatcher.kt",
        "baseline/AndroidClient/app/src/main/java/dev/telemachus/display/NativeInputWire.kt",
        "baseline/AndroidClient/app/src/main/java/dev/telemachus/display/ClientInputDispatch.kt",
        "baseline/AndroidClient/app/src/main/java/dev/telemachus/display/OutboundCommandScheduler.kt",
        "baseline/AndroidClient/app/src/test/java/dev/telemachus/display/StreamInputDispatcherTest.kt",
        "baseline/AndroidClient/app/src/test/java/dev/telemachus/display/NativeInputWireTest.kt",
        "baseline/AndroidClient/app/src/test/java/dev/telemachus/display/ClientInputDispatchTest.kt",
        "baseline/AndroidClient/app/src/test/java/dev/telemachus/display/OutboundCommandSchedulerTest.kt",
        "baseline/AndroidClient/app/src/test/java/dev/telemachus/display/StreamInputBoundaryContractTest.kt",
        "baseline/AndroidClient/app/src/test/java/dev/telemachus/display/StreamClientOwnershipBoundaryContractTest.kt"
      ],
      "fail_closed_checklist": [],
      "focused_tests": [
        "./gradlew --no-daemon testDebugUnitTest --tests dev.telemachus.display.StreamInputDispatcherTest --tests dev.telemachus.display.NativeInputWireTest --tests dev.telemachus.display.ClientInputDispatchTest --tests dev.telemachus.display.StreamInputBoundaryContractTest --tests dev.telemachus.display.StreamClientOwnershipBoundaryContractTest"
      ],
      "id": "stream_client_input_envelope_routing",
      "issues": [],
      "missing_evidence_paths": [],
      "owner_surface": "baseline/AndroidClient/app/src/main/java/dev/telemachus/display/StreamInputDispatcher.kt; baseline/AndroidClient/app/src/main/java/dev/telemachus/display/NativeInputWire.kt; baseline/AndroidClient/app/src/main/java/dev/telemachus/display/ClientInputDispatch.kt; baseline/AndroidClient/app/src/main/java/dev/telemachus/display/OutboundCommandScheduler.kt",
      "required_for_phase0_stable": true,
      "status": "closed",
      "title": "StreamClient input envelope routing owner"
    },
    {
      "blockers": [],
      "can_close": true,
      "evidence_paths": [
        "baseline/AndroidClient/app/src/main/java/dev/telemachus/display/StreamMediaFrameRouter.kt",
        "baseline/AndroidClient/app/src/main/java/dev/telemachus/display/HeartbeatTelemetryReporter.kt",
        "baseline/AndroidClient/app/src/test/java/dev/telemachus/display/StreamMediaFrameRouterTest.kt",
        "baseline/AndroidClient/app/src/test/java/dev/telemachus/display/HeartbeatTelemetryReporterTest.kt",
        "baseline/AndroidClient/app/src/test/java/dev/telemachus/display/StreamClientOwnershipBoundaryContractTest.kt"
      ],
      "fail_closed_checklist": [],
      "focused_tests": [
        "./gradlew --no-daemon testDebugUnitTest --tests dev.telemachus.display.StreamMediaFrameRouterTest --tests dev.telemachus.display.HeartbeatTelemetryReporterTest --tests dev.telemachus.display.StreamClientOwnershipBoundaryContractTest"
      ],
      "id": "stream_client_media_frame_routing",
      "issues": [],
      "missing_evidence_paths": [],
      "owner_surface": "baseline/AndroidClient/app/src/main/java/dev/telemachus/display/StreamMediaFrameRouter.kt; baseline/AndroidClient/app/src/main/java/dev/telemachus/display/HeartbeatTelemetryReporter.kt",
      "required_for_phase0_stable": true,
      "status": "closed",
      "title": "StreamClient media-frame routing owner"
    },
    {
      "blockers": [],
      "can_close": true,
      "evidence_paths": [
        "baseline/AndroidClient/app/src/main/java/dev/telemachus/display/StreamProtocolSideEffectOwner.kt",
        "baseline/AndroidClient/app/src/test/java/dev/telemachus/display/StreamProtocolSideEffectOwnerTest.kt",
        "baseline/AndroidClient/app/src/test/java/dev/telemachus/display/StreamClientProtocolV1IntegrationTest.kt",
        "baseline/AndroidClient/app/src/test/java/dev/telemachus/display/StreamClientOwnershipBoundaryContractTest.kt"
      ],
      "fail_closed_checklist": [],
      "focused_tests": [
        "make baseline-android-protocol-side-effect-owner"
      ],
      "id": "protocol_side_effect_admission",
      "issues": [],
      "missing_evidence_paths": [],
      "owner_surface": "baseline/AndroidClient/app/src/main/java/dev/telemachus/display/StreamProtocolSideEffectOwner.kt",
      "required_for_phase0_stable": true,
      "status": "closed",
      "title": "Protocol v1 side-effect admission owner"
    },
    {
      "blockers": [],
      "can_close": true,
      "evidence_paths": [
        "baseline/AndroidClient/app/src/main/java/dev/telemachus/display/StreamProtocolSessionOwner.kt",
        "baseline/AndroidClient/app/src/main/java/dev/telemachus/display/StreamClientLocalSessionState.kt",
        "baseline/AndroidClient/app/src/main/java/dev/telemachus/display/StreamProtocolSideEffectOwner.kt",
        "baseline/AndroidClient/app/src/test/java/dev/telemachus/display/StreamProtocolSessionOwnerTest.kt",
        "baseline/AndroidClient/app/src/test/java/dev/telemachus/display/StreamClientOwnershipBoundaryContractTest.kt",
        "docs/changes/2026-08-04-phase-0-baseline/TECH.md"
      ],
      "fail_closed_checklist": [],
      "focused_tests": [
        "./gradlew --no-daemon testDebugUnitTest --tests dev.telemachus.display.StreamProtocolSessionOwnerTest --tests dev.telemachus.display.StreamClientOwnershipBoundaryContractTest"
      ],
      "id": "protocol_session_ownership",
      "issues": [],
      "missing_evidence_paths": [],
      "owner_surface": "baseline/AndroidClient/app/src/main/java/dev/telemachus/display/StreamProtocolSessionOwner.kt",
      "required_for_phase0_stable": true,
      "status": "closed",
      "title": "Protocol and session ownership boundary"
    },
    {
      "blockers": [],
      "can_close": true,
      "evidence_paths": [
        "baseline/AndroidClient/app/src/main/java/dev/telemachus/display/FileTransferProductOwner.kt",
        "baseline/AndroidClient/app/src/main/java/dev/telemachus/display/AppSpecificDownloadsSaver.kt",
        "baseline/AndroidClient/app/src/main/java/dev/telemachus/display/internet/InternetProductSession.kt",
        "baseline/AndroidClient/app/src/test/java/dev/telemachus/display/FileTransferProductOwnerTest.kt",
        "baseline/AndroidClient/app/src/test/java/dev/telemachus/display/AppSpecificDownloadsSaverTest.kt",
        "baseline/AndroidClient/app/src/test/java/dev/telemachus/display/MainActivityFileTransferSystemBoundaryContractTest.kt",